{
  "schema_name": "governed-ai-skill-release",
  "schema_version": "1.0.0",
  "release_id": "identify-imd-prospects@1.1.0",
  "skill_name": "identify-imd-prospects",
  "version": "1.1.0",
  "owning_repository": {
    "repository_id": "jesse5656/jryanrussow-site",
    "repository_name": "jesse5656/jryanrussow-site",
    "commit": "b6614c2a05368f30baa9ff9de59d3338e549e061"
  },
  "production_status": "VALIDATED_PRODUCTION",
  "runtime_artifact": {
    "storage_mode": "REPOSITORY_FILE",
    "location": "artifacts/ai-skills/identify-imd-prospects/1.1.0/identify-imd-prospects-v1.1.0.zip",
    "sha256": "194aa7fc05c206e5a68bb891e3ab40ef1399ec9095e7633d6b73d39cad1764c8",
    "byte_size": 66393,
    "format": "zip"
  },
  "runtime_source_path": "skills/identify-imd-prospects",
  "runtime_file_count": 9,
  "validation": {
    "status": "VALIDATED_PRODUCTION",
    "decision_reference": "artifacts/ai-skills/identify-imd-prospects/1.1.0/evidence/VALIDATION-RECORD.md",
    "result": "PASS",
    "validation_run_id": "IMD-V1.1-BLIND-REGRESSION"
  },
  "production_baseline_reference": "artifacts/ai-skills/identify-imd-prospects/1.1.0/evidence/PRODUCTION-BASELINE.md",
  "supported_runtimes": [
    {
      "runtime_class": "CODEX_LOCAL_AGENT_SKILLS",
      "support_status": "PLANNED",
      "adapter_id": null
    },
    {
      "runtime_class": "AI_WORKER_NODE",
      "support_status": "PLANNED",
      "adapter_id": null
    },
    {
      "runtime_class": "API_ORCHESTRATION",
      "support_status": "PLANNED",
      "adapter_id": null
    },
    {
      "runtime_class": "CHATGPT_SKILLS",
      "support_status": "UNKNOWN",
      "adapter_id": null
    },
    {
      "runtime_class": "OTHER_GOVERNED_RUNTIME",
      "support_status": "UNKNOWN",
      "adapter_id": null
    }
  ],
  "dependencies": [],
  "rollback_predecessor": null,
  "created_at": "2026-09-08T14:52:19-05:00"
}
