{
  "schema_name": "governed-ai-skill-release",
  "schema_version": "1.0.0",
  "release_id": "handoff-governed-work@1.0.0",
  "skill_name": "handoff-governed-work",
  "version": "1.0.0",
  "owning_repository": {
    "repository_id": "jesse5656/jryanrussow-site",
    "repository_name": "jesse5656/jryanrussow-site",
    "commit": "36025587a4bc847054ff39c3d1c2b742f8d70e43"
  },
  "production_status": "VALIDATED_PRODUCTION",
  "runtime_artifact": {
    "storage_mode": "REPOSITORY_FILE",
    "location": "artifacts/ai-skills/handoff-governed-work/1.0.0/handoff-governed-work-v1.0.0.zip",
    "sha256": "77495774c0b2888ef4e3aa047454aff03f358cf37a93fe4ab97e0eee07dec99d",
    "byte_size": 7023,
    "format": "zip"
  },
  "runtime_source_path": "skills/handoff-governed-work",
  "runtime_file_count": 8,
  "validation": {
    "status": "VALIDATED_PRODUCTION",
    "decision_reference": "docs/architecture/HANDOFF-GOVERNED-WORK-V1.0-VALIDATION-RECORD.md",
    "result": "PASS"
  },
  "production_baseline_reference": "docs/architecture/HANDOFF-GOVERNED-WORK-V1.0-PRODUCTION-BASELINE.md",
  "supported_runtimes": [
    {
      "runtime_class": "CODEX_LOCAL_AGENT_SKILLS",
      "support_status": "PLANNED",
      "adapter_id": null
    },
    {
      "runtime_class": "AI_WORKER_NODE",
      "support_status": "PLANNED",
      "adapter_id": null
    },
    {
      "runtime_class": "API_ORCHESTRATION",
      "support_status": "PLANNED",
      "adapter_id": null
    },
    {
      "runtime_class": "CHATGPT_SKILLS",
      "support_status": "UNKNOWN",
      "adapter_id": null
    },
    {
      "runtime_class": "OTHER_GOVERNED_RUNTIME",
      "support_status": "UNKNOWN",
      "adapter_id": null
    }
  ],
  "dependencies": [],
  "rollback_predecessor": null,
  "created_at": "2026-09-07T13:45:38-05:00"
}
