{
  "schema_name": "governed-ai-skill-release",
  "schema_version": "1.0.0",
  "release_id": "evaluate-business-capability-architecture@1.0.0",
  "skill_name": "evaluate-business-capability-architecture",
  "version": "1.0.0",
  "owning_repository": {
    "repository_id": "jesse5656/mwg-ops-manual",
    "repository_name": "jesse5656/mwg-ops-manual",
    "commit": "53c67a91d5c50600efca71d59da5e21a5cc2cf91"
  },
  "production_status": "VALIDATED_PRODUCTION",
  "runtime_artifact": {
    "storage_mode": "REPOSITORY_FILE",
    "location": "artifacts/ai-skills/evaluate-business-capability-architecture/1.0.0/evaluate-business-capability-architecture-v1.0.0.zip",
    "sha256": "ac6eb6cf13f2b6beca1113621414bdb8e81224136030598e16109eb1b138c34d",
    "byte_size": 23446,
    "format": "zip"
  },
  "runtime_source_path": "skills/evaluate-business-capability-architecture",
  "runtime_file_count": 6,
  "validation": {
    "status": "VALIDATED_PRODUCTION",
    "decision_reference": "02-Operations/Business-Capability-Catalog/governance/ai-skills/evaluate-business-capability-architecture/1.0.0/RUNTIME-VALIDATION-DECISION-V1.md",
    "result": "PASS",
    "validation_run_id": "RUNTIME-RUN-03"
  },
  "production_baseline_reference": "02-Operations/Business-Capability-Catalog/governance/ai-skills/evaluate-business-capability-architecture/1.0.0/PRODUCTION-BASELINE.md",
  "supported_runtimes": [
    {
      "runtime_class": "CODEX_LOCAL_AGENT_SKILLS",
      "support_status": "PLANNED",
      "adapter_id": null
    },
    {
      "runtime_class": "AI_WORKER_NODE",
      "support_status": "PLANNED",
      "adapter_id": null
    },
    {
      "runtime_class": "API_ORCHESTRATION",
      "support_status": "PLANNED",
      "adapter_id": null
    },
    {
      "runtime_class": "CHATGPT_SKILLS",
      "support_status": "UNKNOWN",
      "adapter_id": null
    },
    {
      "runtime_class": "OTHER_GOVERNED_RUNTIME",
      "support_status": "UNKNOWN",
      "adapter_id": null
    }
  ],
  "dependencies": [],
  "rollback_predecessor": null,
  "created_at": "2026-09-07T13:03:00-05:00"
}
